{
  "id": "phase11-wave2-completion",
  "phase": 11,
  "wave": "wave2-remaining-regional-anchors",
  "status": "complete",
  "prefecture_codes": ["23", "27", "34", "37", "47"],
  "normalizers": [
    "scripts/normalize_phase11_aichi.py",
    "scripts/normalize_phase11_osaka.py",
    "scripts/normalize_phase11_hiroshima.py",
    "scripts/normalize_phase11_kagawa.py",
    "scripts/normalize_phase11_okinawa.py"
  ],
  "completion_manifests": [
    "data/catalog/phase11_aichi_normalization.json",
    "data/catalog/phase11_osaka_normalization.json",
    "data/catalog/phase11_hiroshima_normalization.json",
    "data/catalog/phase11_kagawa_normalization.json",
    "data/catalog/phase11_okinawa_normalization.json"
  ],
  "record_schema": "schemas/phase11_record_linkage.schema.json",
  "summary": {
    "anchors_complete": 5,
    "records": 711,
    "indicator_series": 725,
    "current_value_series_available": 340,
    "current_value_series_missing_or_unavailable": 385,
    "progress_or_explicit_target_series": 602,
    "reviewed_maximum_depth_records": 375,
    "policy_achievement_assessment_count": 0,
    "comparison_eligible_record_count": 0
  },
  "completion_gates": {
    "all_normalizers_execute": "passed",
    "all_records_validate_shared_schema": "passed",
    "global_normalized_ids_unique": "passed",
    "global_source_record_keys_unique": "passed",
    "source_registries_resolve": "passed",
    "anchor_record_counts_reconcile": "passed",
    "missing_and_partial_states_preserved": "passed",
    "all_records_not_assessed": "passed",
    "all_records_excluded_from_comparison": "passed",
    "deterministic_normalization": "passed"
  },
  "completion_boundary": "Wave 2 completes the five remaining regional anchors at the maximum reviewed record depth supported by current official sources. Aichi, Osaka, Hiroshima, and Kagawa include reviewed current observations where available. Okinawa remains plan-baseline-to-R9-target maximum depth because reviewed annual actuals are not yet connected. Completion does not imply policy achievement, causality, or cross-prefecture comparability.",
  "updated_at": "2026-08-02"
}
